{
  "schema_version": "1.0",
  "project": {
    "market": "JP",
    "channel": "amazon-jp",
    "locale": "ja-JP",
    "product_id": "synthetic-example"
  },
  "contents": [
    {
      "content_id": "premium-a",
      "content_type": "premium-a-plus"
    }
  ],
  "active_selection": {
    "enhanced_description_id": "premium-a",
    "brand_content_id": null
  },
  "bindings": [
    {
      "asset_id": "G1",
      "slot_id": "gallery-1",
      "output_ref": "outputs/gallery/g1.png",
      "variation_id": null
    },
    {
      "asset_id": "A1",
      "slot_id": "content:premium-a:module:hero-01:slot:image",
      "output_ref": "outputs/a-plus/hero.png",
      "variation_id": null,
      "content_id": "premium-a",
      "module_id": "hero-01",
      "template_id": "synthetic-premium-hero",
      "slot_key": "image"
    }
  ],
  "listing_family": {
    "parent": {
      "listing_id": "parent",
      "gallery": {
        "gallery-1": "G1"
      },
      "enhanced_description_id": "premium-a"
    },
    "variations": []
  },
  "pending_assets": [],
  "eligibility": {
    "production_freeze_ready": true,
    "required_asset_set_complete": true,
    "approved_output_matches": true,
    "asset_binding_complete": true,
    "blocking_conflicts": [],
    "hard_verification_status": "UNVERIFIED"
  }
}
