{
  "schema_version": "1.0",
  "project": {
    "market": "JP",
    "channel": "amazon-jp",
    "locale": "ja-JP",
    "product_id": "synthetic-example"
  },
  "contents": [],
  "active_selection": {
    "enhanced_description_id": null,
    "brand_content_id": null
  },
  "bindings": [
    {
      "asset_id": "G1",
      "slot_id": "gallery-1",
      "output_ref": "outputs/gallery/g1.png",
      "variation_id": null
    }
  ],
  "listing_family": {
    "parent": {
      "listing_id": "parent",
      "gallery": {
        "gallery-1": "G1"
      }
    },
    "variations": []
  },
  "pending_assets": [],
  "eligibility": {
    "production_freeze_ready": true,
    "required_asset_set_complete": true,
    "approved_output_matches": true,
    "asset_binding_complete": true,
    "blocking_conflicts": [],
    "hard_verification_status": "UNVERIFIED"
  }
}
